[
  {
    "schema_version": "1.0.0",
    "evidence_id": "EVID-QC-001",
    "study_id": "STUDY-QC-001",
    "source": "Synthetic Source 001",
    "protocol_reference": "PROTO-QC-001",
    "sample_identification": "Synthetic Candidate A",
    "control_identification": "Synthetic Reference B",
    "experimental_conditions": "Synthetic controlled condition",
    "measurement_method": "Synthetic validated assay",
    "method_validation_status": "VALIDATED",
    "raw_data_availability": "AVAILABLE",
    "missing_data": [],
    "deviations": [],
    "statistical_reporting": "Synthetic statistical reporting available",
    "reproducibility": "Synthetic repeatability information available",
    "limitations": "Synthetic record for software testing only",
    "evidence_category": "Preclinical",
    "synthetic_data_declaration": "SAMPLE / SYNTHETIC / FOR SOFTWARE TESTING",
    "reviewer_status": "NOT REVIEWED",
    "evidence_quality": "VERIFIED",
    "final_review_status": "OPEN"
  },
  {
    "schema_version": "1.0.0",
    "evidence_id": "EVID-QC-002",
    "study_id": "STUDY-QC-002",
    "source": "Synthetic Source 002",
    "protocol_reference": "PROTO-QC-002",
    "sample_identification": "Synthetic Candidate A",
    "control_identification": "Synthetic Reference B",
    "experimental_conditions": "Synthetic controlled condition",
    "measurement_method": "Synthetic validated assay",
    "method_validation_status": "VALIDATED",
    "raw_data_availability": "NOT_AVAILABLE",
    "missing_data": [
      "Raw data unavailable for synthetic test case"
    ],
    "deviations": [],
    "statistical_reporting": "Synthetic statistical reporting available",
    "reproducibility": "Synthetic repeatability information available",
    "limitations": "Synthetic record for software testing only",
    "evidence_category": "Preclinical",
    "synthetic_data_declaration": "SAMPLE / SYNTHETIC / FOR SOFTWARE TESTING",
    "reviewer_status": "NOT REVIEWED",
    "evidence_quality": "PARTIAL",
    "final_review_status": "OPEN"
  },
  {
    "schema_version": "1.0.0",
    "evidence_id": "EVID-QC-003",
    "study_id": "STUDY-QC-003",
    "source": "",
    "protocol_reference": "PROTO-QC-003",
    "sample_identification": "Synthetic Candidate A",
    "control_identification": "Synthetic Reference B",
    "experimental_conditions": "Synthetic controlled condition",
    "measurement_method": "Synthetic validated assay",
    "method_validation_status": "VALIDATED",
    "raw_data_availability": "AVAILABLE",
    "missing_data": [
      "Source intentionally missing for QC test"
    ],
    "deviations": [],
    "statistical_reporting": "Synthetic statistical reporting available",
    "reproducibility": "Synthetic repeatability information available",
    "limitations": "Synthetic record for software testing only",
    "evidence_category": "Preclinical",
    "synthetic_data_declaration": "SAMPLE / SYNTHETIC / FOR SOFTWARE TESTING",
    "reviewer_status": "NOT REVIEWED",
    "evidence_quality": "NEEDS REVIEW",
    "final_review_status": "OPEN"
  },
  {
    "schema_version": "1.0.0",
    "evidence_id": "EVID-QC-004-A",
    "study_id": "STUDY-QC-004",
    "source": "Synthetic Source 004A",
    "protocol_reference": "PROTO-QC-004",
    "sample_identification": "Synthetic Candidate A",
    "control_identification": "Synthetic Reference B",
    "experimental_conditions": "Synthetic controlled condition",
    "measurement_method": "Synthetic Assay Method A",
    "method_validation_status": "VALIDATED",
    "raw_data_availability": "AVAILABLE",
    "missing_data": [],
    "deviations": [],
    "statistical_reporting": "Synthetic statistical reporting A",
    "reproducibility": "Synthetic repeatability information available",
    "limitations": "Synthetic conflict test",
    "evidence_category": "Preclinical",
    "synthetic_data_declaration": "SAMPLE / SYNTHETIC / FOR SOFTWARE TESTING",
    "reviewer_status": "NOT REVIEWED",
    "evidence_quality": "VERIFIED",
    "final_review_status": "OPEN"
  },
  {
    "schema_version": "1.0.0",
    "evidence_id": "EVID-QC-004-B",
    "study_id": "STUDY-QC-004",
    "source": "Synthetic Source 004B",
    "protocol_reference": "PROTO-QC-004",
    "sample_identification": "Synthetic Candidate A",
    "control_identification": "Synthetic Reference B",
    "experimental_conditions": "Synthetic controlled condition",
    "measurement_method": "Synthetic Assay Method B",
    "method_validation_status": "VALIDATED",
    "raw_data_availability": "AVAILABLE",
    "missing_data": [],
    "deviations": [],
    "statistical_reporting": "Synthetic statistical reporting B",
    "reproducibility": "Synthetic repeatability information available",
    "limitations": "Synthetic conflict test",
    "evidence_category": "Preclinical",
    "synthetic_data_declaration": "SAMPLE / SYNTHETIC / FOR SOFTWARE TESTING",
    "reviewer_status": "NOT REVIEWED",
    "evidence_quality": "VERIFIED",
    "final_review_status": "OPEN"
  },
  {
    "schema_version": "1.0.0",
    "evidence_id": "EVID-QC-005",
    "study_id": "STUDY-QC-005",
    "source": "Synthetic Source 005",
    "protocol_reference": "PROTO-QC-005",
    "sample_identification": "Synthetic Candidate A",
    "control_identification": "Synthetic Reference B",
    "experimental_conditions": "Synthetic controlled condition",
    "measurement_method": "",
    "method_validation_status": "NOT_REPORTED",
    "raw_data_availability": "AVAILABLE",
    "missing_data": [
      "Measurement method intentionally missing"
    ],
    "deviations": [],
    "statistical_reporting": "Synthetic statistical reporting available",
    "reproducibility": "Synthetic repeatability information available",
    "limitations": "Synthetic record for software testing only",
    "evidence_category": "Preclinical",
    "synthetic_data_declaration": "SAMPLE / SYNTHETIC / FOR SOFTWARE TESTING",
    "reviewer_status": "NOT REVIEWED",
    "evidence_quality": "NEEDS REVIEW",
    "final_review_status": "OPEN"
  },
  {
    "schema_version": "1.0.0",
    "evidence_id": "EVID-QC-006",
    "study_id": "",
    "source": "Synthetic Source 006",
    "protocol_reference": "PROTO-QC-006",
    "sample_identification": "Synthetic Candidate A",
    "control_identification": "Synthetic Reference B",
    "experimental_conditions": "Synthetic controlled condition",
    "measurement_method": "Synthetic validated assay",
    "method_validation_status": "VALIDATED",
    "raw_data_availability": "AVAILABLE",
    "missing_data": [
      "Study ID intentionally missing"
    ],
    "deviations": [],
    "statistical_reporting": "Synthetic statistical reporting available",
    "reproducibility": "Synthetic repeatability information available",
    "limitations": "Synthetic record for software testing only",
    "evidence_category": "Preclinical",
    "synthetic_data_declaration": "SAMPLE / SYNTHETIC / FOR SOFTWARE TESTING",
    "reviewer_status": "NOT REVIEWED",
    "evidence_quality": "INSUFFICIENT",
    "final_review_status": "OPEN"
  },
  {
    "schema_version": "1.0.0",
    "evidence_id": "EVID-QC-007",
    "study_id": "STUDY-QC-007",
    "source": "Synthetic Source 007",
    "protocol_reference": "PROTO-QC-007",
    "sample_identification": "Synthetic Candidate A",
    "control_identification": "Synthetic Reference B",
    "experimental_conditions": "Synthetic controlled condition",
    "measurement_method": "Synthetic validated assay",
    "method_validation_status": "VALIDATED",
    "raw_data_availability": "AVAILABLE",
    "missing_data": [],
    "deviations": [],
    "statistical_reporting": "Synthetic statistical reporting available",
    "reproducibility": "Synthetic repeatability information available",
    "limitations": "Synthetic duplicate test",
    "evidence_category": "Preclinical",
    "synthetic_data_declaration": "SAMPLE / SYNTHETIC / FOR SOFTWARE TESTING",
    "reviewer_status": "NOT REVIEWED",
    "evidence_quality": "VERIFIED",
    "final_review_status": "OPEN"
  },
  {
    "schema_version": "1.0.0",
    "evidence_id": "EVID-QC-007",
    "study_id": "STUDY-QC-007",
    "source": "Synthetic Source 007 Duplicate",
    "protocol_reference": "PROTO-QC-007",
    "sample_identification": "Synthetic Candidate A",
    "control_identification": "Synthetic Reference B",
    "experimental_conditions": "Synthetic controlled condition",
    "measurement_method": "Synthetic validated assay",
    "method_validation_status": "VALIDATED",
    "raw_data_availability": "AVAILABLE",
    "missing_data": [],
    "deviations": [],
    "statistical_reporting": "Synthetic statistical reporting available",
    "reproducibility": "Synthetic repeatability information available",
    "limitations": "Synthetic duplicate test",
    "evidence_category": "Preclinical",
    "synthetic_data_declaration": "SAMPLE / SYNTHETIC / FOR SOFTWARE TESTING",
    "reviewer_status": "NOT REVIEWED",
    "evidence_quality": "VERIFIED",
    "final_review_status": "OPEN"
  },
  {
    "schema_version": "1.0.0",
    "evidence_id": "EVID-QC-008",
    "study_id": "STUDY-QC-008",
    "source": "Synthetic Source 008",
    "protocol_reference": "PROTO-QC-008",
    "sample_identification": "Synthetic Candidate A",
    "control_identification": "Synthetic Reference B",
    "experimental_conditions": "Synthetic controlled condition",
    "measurement_method": "Synthetic validated assay",
    "method_validation_status": "VALIDATED",
    "raw_data_availability": "AVAILABLE",
    "missing_data": [],
    "deviations": [],
    "statistical_reporting": "Synthetic statistical reporting available",
    "reproducibility": "Synthetic repeatability information available",
    "limitations": "Synthetic invalid-state test",
    "evidence_category": "Preclinical",
    "synthetic_data_declaration": "SAMPLE / SYNTHETIC / FOR SOFTWARE TESTING",
    "reviewer_status": "NOT A VALID REVIEW STATE",
    "evidence_quality": "VERIFIED",
    "final_review_status": "OPEN"
  },
  {
    "schema_version": "1.0.0",